{
  "$schema": "https://json-schema.org/draft/2020-12/schema",
  "$id": "urn:ai-marketing-hub:claude-ads:schema:control:v1:target-evidence.v1.json",
  "title": "Claude Ads normalized target resolver evidence",
  "type": "object",
  "additionalProperties": false,
  "required": ["schema_version", "evidence_id", "evidence_class", "resolved_at", "source_date_epoch", "source_report_sha256", "source_pip_version", "source_environment", "normalization_notes", "environment", "resolver", "platform_policy", "components"],
  "properties": {
    "schema_version": {"const": "1.0.0"}, "evidence_id": {"type": "string", "minLength": 1},
    "evidence_class": {"const": "cross-target-pip-resolution-requiring-native-ci-confirmation"},
    "resolved_at": {"const": "2026-10-07T00:00:00Z"}, "source_date_epoch": {"const": 1791331200},
    "source_report_sha256": {"type": "string", "pattern": "^[0-9a-f]{64}$"}, "source_pip_version": {"type": "string", "pattern": "^[0-9]+(?:\\.[0-9]+){1,3}$"},
    "source_environment": {"type": "object"}, "normalization_notes": {"type": "array", "items": {"type": "string"}},
    "environment": {"type": "object"}, "resolver": {"const": "pip / PyPI"},
    "platform_policy": {"const": "Exact lowest-common lock with target-selected PyPI wheels"},
    "components": {"type": "array", "minItems": 1}
  }
}
